{
  "$schema": "../schemas/vehicle.schema.json",
  "schemaVersion": "1.0.0",
  "definitionVersion": "0.2.0-documentary",
  "verificationStatus": "Unverified",
  "productionEligible": false,
  "profileId": "1994-buick-roadmaster-estate-lt1-4l60e",
  "manufacturer": "Buick",
  "year": 1994,
  "model": "Roadmaster",
  "body": "Estate Wagon",
  "engine": "5.7L LT1",
  "transmission": "4L60E",
  "pcmFamily": null,
  "calibrationIds": [],
  "aldlDeviceAddress": 244,
  "busStrategy": "A276 8192-baud ALDL on pin M; target vehicle chatter, echo, and calibration verification pending",
  "axleRatioOptions": [],
  "defaultAxleRatio": null,
  "tireSpecification": null,
  "transmissionGearRatios": {},
  "supportedSignals": [
    "engine-speed",
    "vehicle-speed",
    "torque-signal-pressure",
    "force-motor-reference-current",
    "force-motor-actual-current",
    "force-motor-duty-cycle",
    "range-flags",
    "transmission-ignition-voltage",
    "commanded-gear",
    "latest-1-2-shift-error",
    "latest-2-3-shift-error",
    "absolute-slip-source-value",
    "latest-1-2-shift-time",
    "latest-2-3-shift-time",
    "transmission-prom-id",
    "3-2-solenoid-duty-cycle",
    "transmission-output-speed",
    "coolant-temperature",
    "transmission-fluid-temperature",
    "tcc-duty-cycle",
    "transmission-output-commands",
    "shift-status"
  ],
  "supportedTests": [],
  "sourceReferences": [
    "LT1-DATASTREAM-DEFINITIONS-2026-07-30:A276.DS",
    "ECMHACK-ALDL-COMMS-2026-07-30",
    "Target Roadmaster/reference-tool capture pending"
  ]
}
